ski	Alberta is an important destination for tourists who love to ski and hike ; Alberta boasts several world-class ski resort s such as Sunshine Village , Lake Louise , Marmot Basin , Norquay and Nakiska .
ski	For example , each year more water is diverted from rivers for snowmaking in the ski resorts , the effect of which is yet unknown .
ski	In some areas the modern practice of building ski runs by mechanical means has destroyed the underlying tundra from which the plant life can not recover during the non-skiing months , whereas areas that still practice a natural piste type of ski slope building preserve the fragile underlayers .
ski	From 1980 to the present , ski-lifts have been modernized and snow-making machines installed at many resorts , leading to concerns regarding the loss of traditional Alpine culture and questions regarding sustainable development as the winter ski industry continues to develop quickly and the number of summer tourists decline .
ski	Helicopter pads are available at 27 stations ; runways at 15 locations are gravel , sea-ice , blue-ice , or compacted snow suitable for landing wheeled , fixed-wing aircraft ; of these , 1 is greater than 3 km in length , 6 are between 2 km and 3 km in length , 3 are between 1 km and 2 km in length , 3 are less than 1 km in length , and 2 are of unknown length ; snow surface skiways , limited to use by ski - equipped , fixed-wing aircraft , are available at another 15 locations ; of these , 4 are greater than 3 km in length , 3 are between 2 km and 3 km in length , 2 are between 1 km and 2 km in length , 2 are less than 1 km in length , and data is unavailable for the remaining 4 .
ski	There is no distinction made in Scotland between assault and battery ( which is not a term used in Scots law ) , although , as in England and Wales , assault can be occasioned without a physical attack on another 's person , as demonstrated in Atkinson v. HM Advocate wherein the accused was found guilty of assaulting a shop assistant by simply jumping over a counter wearing a ski mask .
ski	Schwarzenegger tripped over his ski pole and broke his right femur while skiing in Sun Valley , Idaho , with his family on December 23 , 2006 .
ski	The Sun Valley Resort has a short ski trail called Arnold 's Run , named after Schwarzenegger in 2001 .
ski	Nevertheless , Canberra stands as an exemplary city design and is located halfway between the ski slopes and the beach .
ski	A ski jump is a fixed ramp at the end of the flight deck with a curved incline .
door	In 1973 , Atari secretly spawned a " competitor " called Kee Games , headed by Nolan 's next door neighbor Joe Keenan , to circumvent pinball distributors ' insistence on exclusive distribution deals ; both Atari and Kee could market ( virtually ) the same game to different distributors , with each getting an " exclusive " deal .
door	Initially , it was " Türer , " meaning doormaker , which is " ajtós " in Hungarian ( from " ajtó " , meaning door ) .
door	A door is featured in the coat-of-arms the family acquired .
door	One afternoon about three days ago [ the publishers ] showed up at my door with no warning , and loaded about forty pounds of supplies into the room : two cases of Mexican beer , four quarts of gin , a dozen grapefruits , and enough speed to alter the outcome of six Super Bowl s. ... Meanwhile , [ ... ] with the final chapter still unwritten and the presses scheduled to start rolling in twenty-four hours . . . . unless somebody shows up pretty soon with extremely powerful speed , there might not be a final chapter .
door	The triforium ( open arcade ) above the door is unique in Scottish medieval architecture .
door	Post-Renaissance classicism Aedicular door surrounds that are architecturally treated , with pilasters or columns flanking the doorway and an entablature even with a pediment over it came into use with the 16th century .
door	The revolution of 1897-98 opened the door to wider knowledge , and much exploration has ensued , for which see Crete .
door	Some of the caves have elaborate carved entrances , some with large windows over the door to admit light .
door	On either side of the door is a square-shaped window to brighten the interior .
door	Thus if the instrument depends on the pressure or suction effect alone , and this pressure or suction is measured against the air pressure in an ordinary room , in which the doors and windows are carefully closed and a newspaper is then burnt up the chimney , an effect may be produced equal to a wind of 10 mi/h ( 16 km/h ) ; and the opening of a window in rough weather , or the opening of a door , may entirely alter the registration .
